museo_id,museo_nombre,museo_tematica_n1,museo_fecha_fundacion,museo_adscripcion,estado_id,nom_ent,municipio_id,nom_mun,localidad_id,nom_loc,museo_calle_numero,museo_colonia,museo_cp,museo_telfono1,pagina_web,pagina_web2,email,twitter,gmaps_longitud,gmaps_latitud,link_sic,fecha_mod,,,
1856,Museo de Arte Sacro,Arte,11/09/2015,,22,Queretaro,14,Queretaro,1,SANTIAGO DE QUERETARO,Allende 4,Centro Historico,76000,,https://www.facebook.com/Museo-de-Arte-Sacro-Qro-1218206318205589/?fref=ts,,museodeartesacrodequeretaro@gmail.com,MuseoArteSaQro,-100.3935,20.59104,http://sic.gob.mx/ficha.php?table=museo&table_id=1856,22/06/2016 13:26,,,
1951,Museo de Horror Animas,Sin catalogar,19/09/2017,,22,Queretaro,14,Queretaro,1,SANTIAGO DE QUERETARO,Calle Ignacio Allende numero 33,Centro,76000,,https://www.museoanimas.com/,,animasmuseo@gmail.com,,-100.39498,20.59485,http://sic.gob.mx/ficha.php?table=museo&table_id=1951,15/11/2017 13:23,,,
1772,Museo del Ferrocarril de Queretaro,Historia,21/01/2015,Instituto de Cultura del Municipio de Queretaro,22,Queretaro,14,Queretaro,1,SANTIAGO DE QUERETARO,Heroe de Nacozari s/n,Centro Historico,76000,,,,,,0,0,http://sic.gob.mx/ficha.php?table=museo&table_id=1772,31/05/2016 12:37,,,
1948,Museo Indigena Queretaro,Arte,28/01/2014,Comision Nacional para el Desarrollo de los Pueblos Indigenas (CDI) Delegacion Queretaro,22,Queretaro,14,Queretaro,1,SANTIAGO DE QUERETARO,Allende 20 Sur,Centro,76000,,,,dbarcenas@cdi.gob.mx,,-100.39313,20.58994,http://sic.gob.mx/ficha.php?table=museo&table_id=1948,29/11/2017 11:24,,,
435,Museo de la Restauracion de la Republica,Historia,14/08/2003,Secretaria de Cultura del Estado de Queretaro,22,Queretaro,14,Queretaro,1,SANTIAGO DE QUERETARO,Guerrero 23 Nte.,Centro Historico,76000,,,,museoqro@gmail.com,,-100.39572,20.59295,http://sic.gob.mx/ficha.php?table=museo&table_id=435,11/05/2017 11:03,,,
65,Museo del Cerro de las Campanas,Historia,28/08/2003,Instituto Municipal de Cultura,22,Queretaro,14,Queretaro,1,SANTIAGO DE QUERETARO,Circuito Cerro de las Campanas s/n,Centro Historico,76000,,http://culturaqueretaro.gob.mx/iqca/sitio/Espaciosculturalescontroller/recinto/89,http://www.de-paseo.com/SitiosInteres/MuseoMagiaPasado.htm,contacto_museo@municipiodequeretaro.gob.mx,,-100.4109,20.59303,http://sic.gob.mx/ficha.php?table=museo&table_id=65,11/05/2017 10:04,,,
436,Museo de Arte de Queretaro,Arte,22/09/1988,Secretaria de Cultura del Estado de Queretaro,22,Queretaro,14,Queretaro,1,SANTIAGO DE QUERETARO,Allende 14 Sur,Centro Historico,76000,,https://www.facebook.com/museodeartedequeretaro/,,recepcionmaqro1@gmail.com,MuseoDeArteQRO,-100.39349,20.59105,http://sic.gob.mx/ficha.php?table=museo&table_id=436,11/05/2017 10:52,,,
434,Museo Regional de Queretaro,Historia,06/11/1936,Secretaria de Cultura/INAH,22,Queretaro,14,Queretaro,1,SANTIAGO DE QUERETARO,Corregidora 3 Sur,Centro,76000,,http://www.inah.gob.mx/zonas/121-museo-regional-de-queretaro,,museoregional.qro@inah.gob.mx,museoregqro,-100.39107,20.59263,http://sic.gob.mx/ficha.php?table=museo&table_id=434,11/05/2017 09:26,,,
172,Museo Casa de la Zacatecana,Arte,01/07/2001,"Museo Casa de la Zacatecana, A.C.",22,Queretaro,14,Queretaro,1,SANTIAGO DE QUERETARO,Independencia 59,Centro Historico,76000,,http://www.museolazacatecana.com/,,casazacatecana@gmail.com,,-100.3885,20.5925,http://sic.gob.mx/ficha.php?table=museo&table_id=172,11/05/2017 09:35,,,
433,Museo de la Ciudad Santiago de Queretaro,Arte,14/02/1997,Secretaria de Cultura del Estado de Queretaro,22,Queretaro,14,Queretaro,1,SANTIAGO DE QUERETARO,Guerrero 27 Nte.,Centro Historico,76000,,http://museodelaciudadqro.org/,,museodelaciudadqro@gmail.com,,-100.39582,20.59259,http://sic.gob.mx/ficha.php?table=museo&table_id=433,11/05/2017 10:53,,,
1786,Museo de los Conspiradores,Historia,13/09/2015,Secretaria de Cultura del Estado de Queretaro,22,Queretaro,14,Queretaro,1,SANTIAGO DE QUERETARO,Andador 15 de Mayo num. 18,Centro Historico,76000,,https://www.facebook.com/museodelosconspiradores/,http://culturaqueretaro.gob.mx/iqca/sitio/Espaciosculturalescontroller/recinto/9,museodelosconspiradores@gmail.com,museodelosconspiradores,-100.39011,20.59331,http://sic.gob.mx/ficha.php?table=museo&table_id=1786,23/08/2017 19:19,,,
1680,Museo Fundacion Santiago Carbonell,Arte,14/05/2014,"Fundacion Santiago Carbonell, Amigos del Museo Santiago Carbonell, A.C.",22,Queretaro,14,Queretaro,1,SANTIAGO DE QUERETARO,Calle 5 de Mayo 90,Centro Historico,76000,,http://museosantiagocarbonell.com/,https://www.facebook.com/santiago.carbonell.56?fref=ts,contacto@museosantiagocarbonell.com,,-100.38688,20.59423,http://sic.gob.mx/ficha.php?table=museo&table_id=1680,11/05/2017 11:08,,,
1623,Museo Comunitario Mineral de San Joaquin,Arqueologia,01/04/2010,Direccion de Turismo del Ayuntamiento de San Joaquin,22,Queretaro,15,San Joaquin,1,SAN JOAQUIN,Francisco Zarco s/n esq. Insurgentes,Centro,76550,,,,turismo@sanjoaquin.gob.mx, turismo_sj@yahoo.com.mx,,-99.5654,20.91583,http://sic.gob.mx/ficha.php?table=museo&table_id=1623,29/07/2014 11:58,,
38,Museo de la Muerte,Historia,24/06/1997,Ayuntamiento de San Juan del Rio,22,Queretaro,16,San Juan del Rio,1,SAN JUAN DEL RIO,2 de Abril num. 42,Centro,76800,,,,juanaavila@gmail.com, santanamarimar@gmail.com,,-99.99543,20.38621,http://sic.gob.mx/ficha.php?table=museo&table_id=38,04/05/2016 12:00,,
408,Museo Iztacchichimecapan,Historia,24/06/1991,Ayuntamiento de San Juan del Rio,22,Queretaro,16,San Juan del Rio,1,SAN JUAN DEL RIO,Av. Juarez 30 Oriente,Centro,76800,,,,juanaavila@gmail.com, santanamarimar@gmail.com,,-99.99573,20.38635,http://sic.gob.mx/ficha.php?table=museo&table_id=408,09/12/2014 12:44,,
1719,Museo Mexico me Encanta. Tradiciones mexicanas en miniatura,Arte,12/04/2014,Ayuntamiento de Tequisquiapan,22,Queretaro,17,Tequisquiapan,1,TEQUISQUIAPAN,Calle 5 de Mayo num. 11,Centro,76750,,https://www.facebook.com/MuseoMexicomeencanta?fref=ts&rf=277385259104611,,matere.cisneros@gmail.com,,-99.89217,20.52219,http://sic.gob.mx/ficha.php?table=museo&table_id=1719,21/02/2017 08:49,,,
256,Museo Comunitario Ya Nfadi Ya Ñohño (Los conocimientos de los otomies),Antropologia,27/09/1995,Union Estatal de Museos Comunitarios del Estado de Queretaro,22,Queretaro,18,Toliman,1,TOLIMAN,Av. Juarez s/n,Centro,76630,,,,,,0,0,http://sic.gob.mx/ficha.php?table=museo&table_id=256,29/07/2014 11:59,,,
98,Museo de la Isla de Cozumel,Ciencia y tecnologia,04/04/1987,"Fundacion de Parques y Museos de Cozumel, Quintana Roo, A.C.",23,Quintana Roo,1,Cozumel,1,COZUMEL,Av. Rafael E. Melgar s/n,Centro,77600,,http://www.cozumelparks.com/esp/museo_isla.cfm,https://www.facebook.com/MuseoCozumel,museodireccion@hotmail.com,,-86.94709,20.50562,http://sic.gob.mx/ficha.php?table=museo&table_id=98,09/10/2015 13:09,,,
311,Museo de la Guerra de Castas,Historia,24/03/1993,Secretaria de Cultura del Estado de Quintana Roo,23,Quintana Roo,2,Felipe Carrillo Puerto,1,FELIPE CARRILLO PUERTO,Calle 17 esq. Calle 26,Centro,77121,,http://www.mguerradecastas.es.tl/Historia.htm,https://www.facebook.com/museogcastas/info,museogcastas@hotmail.com,,0,0,http://sic.gob.mx/ficha.php?table=museo&table_id=311,04/07/2016 14:30,,,
1638,Museo Maya Santa Cruz Xbaalam Naj,Arte,22/03/2010,Secretaria de Cultura de Quintana Roo/Ayuntamiento de Felipe Carrillo Puerto,23,Quintana Roo,2,Felipe Carrillo Puerto,1,FELIPE CARRILLO PUERTO,Calle 63 s/n entre Benito Juarez y Calle 64,Centro,77200,,,http://www.culturaquintanaroo.com/?page_id=112,cpopulares_85@hotmail.com,,0,0,http://sic.gob.mx/ficha.php?table=museo&table_id=1638,04/07/2016 15:06,,,
331,Museo de la Ciudad de Chetumal,Historia,26/03/1999,Secretaria de Cultura del Estado de Quintana Roo,23,Quintana Roo,4,Othon P. Blanco,1,CHETUMAL,Av. Heroes 68,Centro,77000,,http://www.secqr.gob.mx/museos/index.php?option=com_content&view=article&id=105&Itemid=27&lang=es,,lourdeslulu139@hotmail.com, museosqroo@hotmail.com,,-88.2966,18.50142,http://sic.gob.mx/ficha.php?table=museo&table_id=331,04/07/2016 10:56,,
106,Museo de la Cultura Maya,Arqueologia,14/09/1994,Secretaria de Cultura del Estado de Quintana Roo,23,Quintana Roo,4,Othon P. Blanco,1,CHETUMAL,Av. Heroes esq. Mahatma Gandhi s/n,Centro,77000,,http://www.secqr.gob.mx/museos/index.php?option=com_content&view=article&id=89&Itemid=55&lang=es,,museomaya@hotmail.com, museosqroo@hotmail.com,,-88.29542,18.50444,http://sic.gob.mx/ficha.php?table=museo&table_id=106,04/07/2016 10:45,,
479,Museo Comunitario  Casa Maya,Historia,01/05/1998,Direccion de Ecologia Municipal/ Ayuntamiento de Benito Juarez,23,Quintana Roo,5,Benito Juarez,1,CANCUN,Parque Urbano  Kabah s/n,Centro,77500,,,,,,-86.84009,21.14165,http://sic.gob.mx/ficha.php?table=museo&table_id=479,29/04/2015 09:58,,,
1735,Museo del Agua Chooj Kuun (Oro azul),Ciencia y tecnologia,19/07/2013,"Complejo Cientifico, Tecnologico y Cultural Planetario Cancun Ka Yok",23,Quintana Roo,5,Benito Juarez,1,CANCUN,"Av.  Palenque s/n, SM 21 M 05 Lt 1",,77500,,http://www.ventanaaluniverso.org/#!museo-del-agua/c9y4,https://www.facebook.com/planetariodecancun,,,0,0,http://sic.gob.mx/ficha.php?table=museo&table_id=1735,20/08/2015 17:39,,,
1438,Museo Subacuatico de Arte (MUSA),Arte,01/11/2009,Asociacion de Nauticos de Cancun,23,Quintana Roo,5,Benito Juarez,1,CANCUN,"Blvd. Kukulcan Km 10.3 , Punta Cancun y Punta Nizuc ",Zona Hotelera,77500,,http://www.musacancun.com,http://www.aquaworld.com.mx/underwatermuseum.html,jason@musacancun.com,AquaworldCancun,-86.80658,21.07505,http://sic.gob.mx/ficha.php?table=museo&table_id=1438,29/11/2016 11:06,,,
1736,Planetario Ka Yok,Ciencia y tecnologia,19/07/2013,CONACYT,23,Quintana Roo,5,Benito Juarez,1,CANCUN,"Av. Palenque SMZ 21, Mz.5, L. 1",,77500,,http://www.ventanaaluniverso.org/,https://www.facebook.com/planetariodecancun/timeline,,,-86.83304,21.15307,http://sic.gob.mx/ficha.php?table=museo&table_id=1736,20/08/2015 17:45,,,
1595,Museo Maya de Cancun,Arqueologia,01/11/2012,Secretaria de Cultura/INAH,23,Quintana Roo,5,Benito Juarez,1,CANCUN,Blvd. Kukulcan  km. 16.5 esq. Cucumate,Zona Hotelera de Cancun,77500,,http://www.inah.gob.mx/red-de-museos/313-museo-maya-de-cancun,http://www.inah.gob.mx/paseos/museomaya/tour.html,museomayacancun@inah.gob.mx,,-86.76755,21.09879,http://sic.gob.mx/ficha.php?table=museo&table_id=1595,22/03/2016 13:53,,,
903,Museo La Casa del Arte Popular Mexicano de Xcaret (Hacienda Henequenera),Arte,14/09/2002,"Flora, Fauna y Cultura de Mexico, A.C.",23,Quintana Roo,8,Solidaridad,1,PLAYA DEL CARMEN,"Carr. Chetumal-Puerto Juarez, Km. 282",Parque Xcaret,77710,,http://www.xcaret.com.mx/hacienda-henequenera,,gaaapa@hotmail.com, paco@museoartepopularmexicano.org,,-87.12137,20.58024,http://sic.gob.mx/ficha.php?table=museo&table_id=903,30/03/2016 14:58,,
1857,Sayab. Planetario de Playa del Carmen,Ciencia y tecnologia,16/12/2016,Red de observatorios Astronomicos de Quintana Roo,23,Quintana Roo,8,Solidaridad,1,PLAYA DEL CARMEN,Av. Paseo Central s/n Lt. 016 Mz 001,,77750,,http://www.planetariodeplayadelcarmen.org/,https://www.facebook.com/Planetariodeplayadelcarmen/,,,-87.08494,20.65198,http://sic.gob.mx/ficha.php?table=museo&table_id=1857,09/05/2017 17:51,,,
1928,Museo Frida Khalo,Sin catalogar,31/07/2017,Fundacion Frida Khalo,23,Quintana Roo,8,Solidaridad,1,PLAYA DEL CARMEN,Calle Quinta Avenida y Calle 8,Centro,77710,,https://www.facebook.com/MuseoFKRM/,,alelopestrada@gmail.com,,-87.07273,20.62598,http://sic.gob.mx/ficha.php?table=museo&table_id=1928,25/10/2017 13:43,,,
426,Museo de Rescates Subacuaticos,Arqueologia,01/01/1988,Centro de Estudios y Deportes Acuaticos de Mexico (CEDAM),23,Quintana Roo,8,Solidaridad,308,PUERTO AVENTURAS,"Blvd. Puerto Aventura s/n, Centro Comercial Marina",Puerto Aventura,77782,,http://www.puertoaventuras.com.mx/servicios,,adriana@puertoaventuras.com.mx,,,-87.34706,20.35199,http://sic.gob.mx/ficha.php?table=museo&table_id=426,11/06/2016 12:30,,
1700,Museo de la Prehistoria Parque Dos Ojos,Ciencia y tecnologia,01/04/2014,Instituto de la Prehistoria de America,23,Quintana Roo,9,Tulum,74,DOS OJOS,Casa Ejidal del Cenote Dos Ojos (Jacinto Pat),,,,https://www.facebook.com/MuseodelaPrehistoriaDosOjos,,,,0,0,http://sic.gob.mx/ficha.php?table=museo&table_id=1700,11/06/2016 11:15,,,
1953,Museo Julian Carrillo,Sin catalogar,30/01/2012,Municipio de Ahualulco,24,San Luis Potosi,1,Ahualulco,1,AHUALULCO DEL SONIDO 13,Nabor Carrillo 9,,,,,,gas_tony@hotmail.com,,0,0,http://sic.gob.mx/ficha.php?table=museo&table_id=1953,22/11/2017 12:02,,,
220,Museo Parroquial Padre Jose Robledo,Historia,01/01/1976,Parroquia de la Purisima Concepcion,24,San Luis Potosi,6,Catorce,1,REAL DE CATORCE,Lanzagorta 36,Centro,78550,,,,ernestoveg@yahoo.com.mx,,-100.88698,23.6902,http://sic.gob.mx/ficha.php?table=museo&table_id=220,21/08/2015 13:05,,,
1954,Museo Regional de Cerritos,Historia,11/03/2000,"Direccion de Cultura, Presidencia Municipal de Cerritos",24,San Luis Potosi,8,Cerritos,1,CERRITOS,Plaza Morelos 6,Centro,79402,,,,cultura_cerritos@hotmail.com,,-100.28457,22.43323,http://sic.gob.mx/ficha.php?table=museo&table_id=1954,16/11/2017 13:22,,,
1515,Museo de Ciudad del Maiz,Historia,12/02/2010,"El Gran Lente, A.C.",24,San Luis Potosi,10,Ciudad del Maiz,1,CIUDAD DEL MAIZ,Manuel Jose Othon s/n,Centro,79320,,,,museomaiz@hotmail.com,,0,0,http://sic.gob.mx/ficha.php?table=museo&table_id=1515,17/06/2016 09:27,,,
1367,Museo Maam Tsitsin Inik (Dios Hombre-Pajaro),Antropologia,01/01/2009,Comunitario,24,San Luis Potosi,12,Tancanhuitz,1,TANCANHUITZ,Centro Ceremonial Tam-Aletom 1a. Seccion,Centro,,,,,jozbers_@hotmail.com,,0,0,http://sic.gob.mx/ficha.php?table=museo&table_id=1367,07/07/2015 12:54,,,
407,Museo Regional Huasteco,Arqueologia,31/12/1978,"Patronato del Museo Regional Huasteco, A.C.",24,San Luis Potosi,13,Ciudad Valles,1,CIUDAD VALLES,Rotarios 8960,Col. Rotarios,79080,,,,bibliomuseo_8360@hotmail.com,,-99.00978,21.98137,http://sic.gob.mx/ficha.php?table=museo&table_id=407,17/06/2016 09:30,,,
845,Museo de las Culturas de la Huasteca Potosina Tamuantzan,Arqueologia,23/01/1997,Secretaria de Cultura del Gobierno del Estado de San Luis Potosi/Centro Cultural de la Huasteca,24,San Luis Potosi,13,Ciudad Valles,1,CIUDAD VALLES,Carr. Mexico-Laredo y Libramiento Sur,Fracc. Lomas de San Jose,79090,,https://es-la.facebook.com/museotamuantzan/,,,,-98.99406,21.96971,http://sic.gob.mx/ficha.php?table=museo&table_id=845,19/06/2017 11:10,,,
1110,Museo de Arte Sacro San Pedro de Guadalcazar,Arte,01/12/2011,Patronato de la Parroquia de Guadalcazar,24,San Luis Potosi,17,Guadalcazar,1,GUADALCAZAR,Jardin Hidalgo 2,Centro,78880,,,https://www.facebook.com/media/set/?set=a.354218158006617.84358.145096375585464&type=3,museoartesacrospedro@yahoo.com.mx: mariamendez@yahoo.com.mx,,-100.39768,22.61299,http://sic.gob.mx/ficha.php?table=museo&table_id=1110,17/06/2016 09:34,,,
405,Museo Comunitario Caich,Antropologia,1000-01-01,"Caich, Asociacion Civil",24,San Luis Potosi,18,Huehuetlan,2,CHUNUNTZEN UNO,Chununtzen 1,,79893,,,,,,-98.97431,21.48532,http://sic.gob.mx/ficha.php?table=museo&table_id=405,17/06/2016 09:57,,,
659,Museo de las Culturas de Matehuala,Historia,23/12/2003,Ayuntamiento de Matehuala,24,San Luis Potosi,20,Matehuala,1,MATEHUALA,Hidalgo 703 Nte.,Centro,78700,,,,luisarameo2@hotmail.com,,-100.64538,23.66795,http://sic.gob.mx/ficha.php?table=museo&table_id=659,17/06/2016 10:09,,,
447,Museo de Historia Natural Jose Vilet Brullet,Ciencia y tecnologia,01/07/1993,Particular,24,San Luis Potosi,21,Mexquitic de Carmona,1,MEXQUITIC DE CARMONA,Km. 22 Carr. San Luis Potosi-Zacatecas,,78480,,http://zoologicosanluispotosi.blogspot.com/,,josepvilet@yahoo.com.mx,,0,0,http://sic.gob.mx/ficha.php?table=museo&table_id=447,13/06/2017 11:52,,,
642,Museo Regional del Rio verde,Historia,14/01/1999,Programa Nacional de Museos Comunitarios,24,San Luis Potosi,24,Rioverde,1,RIOVERDE,Gral. Mariano Matamoros 143,Centro,79610,,http://es-es.facebook.com/pages/Museo-Regional-de-Rio-Verde/113995251999388,,museoregional1@hotmail.com,,-99.99975,21.93525,http://sic.gob.mx/ficha.php?table=museo&table_id=642,17/06/2016 10:13,,,
1127,Museo Interactivo Colibri,Ciencia y tecnologia,01/08/2003,Gobierno Municipal de Rioverde,24,San Luis Potosi,24,Rioverde,1,RIOVERDE,Heroes Potosinos 444,Centro,79650,,,http://www.facebook.com/note.php?note_id=394472923919601,colibri_direccion@hotmail.com,,-100.00179,21.93395,http://sic.gob.mx/ficha.php?table=museo&table_id=1127,17/06/2016 10:12,,,
1364,Museo de Sitio de Salinas,Historia,19/11/2006,Secretaria de Cultura del Gobierno del Estado de San Luis Potosi,24,San Luis Potosi,25,Salinas,1,SALINAS DE HIDALGO,Jesus M. Isais s/n,Centro Historico,78600,,,,cultura_salinas@hotmail.com,,-101.71673,22.62915,http://sic.gob.mx/ficha.php?table=museo&table_id=1364,17/06/2016 10:14,,,
1955,Planetario del Parque Tangamanga,Ciencia y tecnologia,1000-01-01,,24,San Luis Potosi,28,San Luis Potosi,1,SAN LUIS POTOSI,Artesanos s/n,Parque Tangamanga,,,https://www.facebook.com/pages/Planetario-Del-Parque-Tangamanga/149999028464909,,hg_morenolimon@hotmail.com,,0,0,http://sic.gob.mx/ficha.php?table=museo&table_id=1955,16/11/2017 12:12,,,
522,Museo Federico Silva. Escultura Contemporanea,Arte,18/09/2003,Secretaria de Cultura del Gobierno del Estado de San Luis Potosi,24,San Luis Potosi,28,San Luis Potosi,1,SAN LUIS POTOSI,"Alvaro Obregon 80, Jardin de San Juan de Dios",Centro Historico,78000,,http://www.museofedericosilva.org,,contacto@museofedericosilva.org,,-100.97454,22.15302,http://sic.gob.mx/ficha.php?table=museo&table_id=522,17/06/2016 10:24,,,
1362,Museo del Ferrocarril Jesus Garcia Corona. Heroe de Nacozari,Historia,12/08/2009,Secretaria de Cultura del Gobierno del Estado de San Luis Potosi,24,San Luis Potosi,28,San Luis Potosi,1,SAN LUIS POTOSI,Manuel Jose Othon s/n,Centro Historico,78000,,http://culturaslp.gob.mx/museodelferrocarril,,museodelferrocarrilslp@gmail.com,,-100.97123,22.15295,http://sic.gob.mx/ficha.php?table=museo&table_id=1362,17/06/2016 10:18,,,
1360,Museo del Exvoto,Arte,1000-01-01,Parroquia del Santuario de Nuestro Señor del Saucito,24,San Luis Potosi,28,San Luis Potosi,1,SAN LUIS POTOSI,Av. Fray Diego de la Magdalena 80,Col. Division del Norte,78250,,,,burgossaucito@yahoo.com,,0,0,http://sic.gob.mx/ficha.php?table=museo&table_id=1360,21/11/2012 12:23,,,
887,Museo Nacional de la Mascara,Arte,10/03/1982,Secretaria de Cultura del Gobierno del Estado de San Luis Potosi,24,San Luis Potosi,28,San Luis Potosi,1,SAN LUIS POTOSI,"Villerias 2, Plaza del Carmen",Centro Historico,78000,,http://munamasc.blogspot.com/,http://culturaslp.gob.mx/museos/sanluis/museodelamascara,museodelamascara@hotmail.com,,-100.97405,22.15077,http://sic.gob.mx/ficha.php?table=museo&table_id=887,17/06/2016 10:35,,,
524,Museo Francisco Cossio,Antropologia,20/11/1970,Secretaria de Cultura del Gobierno del Estado de San Luis Potosi,24,San Luis Potosi,28,San Luis Potosi,1,SAN LUIS POTOSI,Av. Venustiano Carranza 1815,Col. Jardin,78270,,http://culturaslp.gob.mx/museo-francisco-cossio/,https://www.facebook.com/Museofranciscocossio,museofranciscocossio@gmail.com,,-101.00327,22.14917,http://sic.gob.mx/ficha.php?table=museo&table_id=524,17/06/2016 10:17,,,
1810,Museo Interactivo de Tecnologia Aplicada (MITA),Ciencia y tecnologia,1000-01-01,Facultad de Ingenieria de la Universidad Autonoma de San Luis Potosi,24,San Luis Potosi,28,San Luis Potosi,1,SAN LUIS POTOSI,Alvaro Obregon 64,Centro,78000,,,,direccionfiuaslp@gmail.com, rosma.fi.uaslp@gmail.com, difusion.cultural@uaslp.mx, direccion@ing.uaslp.mx,,0,0,http://sic.gob.mx/ficha.php?table=museo&table_id=1810,23/02/2017 22:10
440,Museo del Virreinato,Arte,19/09/2003,Secretaria de Cultura del Gobierno del Estado de San Luis Potosi,24,San Luis Potosi,28,San Luis Potosi,1,SAN LUIS POTOSI,"Villerias 115, Ex Convento del Carmen",Centro Historico,78000,,http://www.museodelvirreinato.mx,http://culturaslp.gob.mx/museo-del-virreinato/,direcciongeneral@museodelvirreinato.mx,Mvslp,-100.97381,22.15135,http://sic.gob.mx/ficha.php?table=museo&table_id=440,17/06/2016 10:22,,,
660,Museo Regional Potosino,Arqueologia,20/11/1952,Secretaria de Cultura/INAH,24,San Luis Potosi,28,San Luis Potosi,1,SAN LUIS POTOSI,Plaza Aranzazu s/n,Centro Historico,78000,,http://www.inah.gob.mx/red-de-museos/217-museo-regional-potosino,,museoregionalpotosino.direccion@yahoo.com.mx, servicioseducativosmrp@yahoo.com.mx,MuseoRP,-100.97827,22.14878,http://sic.gob.mx/ficha.php?table=museo&table_id=660,17/06/2016 10:20,,
1231,Museo Laberinto de las Ciencias y las Artes,Ciencia y tecnologia,06/09/2008,Secretaria de Cultura del Gobierno del Estado de San Luis Potosi,24,San Luis Potosi,28,San Luis Potosi,1,SAN LUIS POTOSI,Blvd. Antonio Rocha Cordero s/n,Col. Tierra Blanca,78364,,http://www.museolaberinto.com/,https://www.facebook.com/museo.interactivo.bienvenido,info@museolaberinto.com,museolaberinto,-100.9992,22.1174,http://sic.gob.mx/ficha.php?table=museo&table_id=1231,17/06/2016 10:27,,,
1964,Museo de Arte Religioso,Historia,22/07/2017,,24,San Luis Potosi,28,San Luis Potosi,1,SAN LUIS POTOSI,Avanzada  580 esquina con Av. Cuauhtemoc,Col. De Tequisquiapan,78230,,https://www.facebook.com/Atrioslp/,,galeriaherrera@hotmail.com,,-100.99652,22.14754,http://sic.gob.mx/ficha.php?table=museo&table_id=1964,04/12/2017 12:34,,,
1361,Museo de Arte Contemporaneo (MAC),Arte,14/08/2009,Secretaria de Cultura del Gobierno del Estado de San Luis Potosi,24,San Luis Potosi,28,San Luis Potosi,1,SAN LUIS POTOSI,Morelos 235,Centro Historico,78000,,http://www.macsanluispotosi.com,,museoartecont@gmail.com,,-100.97563,22.15398,http://sic.gob.mx/ficha.php?table=museo&table_id=1361,17/06/2016 10:33,,,
47,Museo de Tauromaquia,Especializado,25/08/1973,"Centro Taurino Potosino, S.C.P.A.",24,San Luis Potosi,28,San Luis Potosi,1,SAN LUIS POTOSI,Av. Universidad s/n,Centro,78000,,,,,,-100.96496,22.15118,http://sic.gob.mx/ficha.php?table=museo&table_id=47,01/06/2017 13:00,,,
519,Casa de Manuel Jose Othon,Historia,28/11/1966,Secretaria de Cultura del Gobierno del Estado de San Luis Potosi,24,San Luis Potosi,28,San Luis Potosi,1,SAN LUIS POTOSI,Manuel Jose Othon 225,Centro Historico,78000,,http://culturaslp.gob.mx/museo-othoniano/,https://www.facebook.com/casa.museoothon,casaothonslp@hotmail.com,,-100.97492,22.15165,http://sic.gob.mx/ficha.php?table=museo&table_id=519,19/06/2017 11:48,,,
52,Museo Comunitario de la Villa de Ahome,Arqueologia,05/01/1999,"Instituto Sinaloense de Cultura/Ecomuseos de Sinaloa, A.C.",25,Sinaloa,1,Ahome,1,LOS MOCHIS,Ignacio Zaragoza s/n,Centro,81110,,,,sandra.robles@culturasinaloa.gob.mx,,0,0,http://sic.gob.mx/ficha.php?table=museo&table_id=52,15/05/2015 13:10,,,
1860,Museo Casa de la Cultura Profesor Conrado Espinosa,Arte,08/12/1995,Municipio de Ahome,25,Sinaloa,1,Ahome,1,LOS MOCHIS,Belisario Dominguez s/n al pie del Cerro de la Memoria,Col. Bugambilias,81216,,,,casacultura@ahome.gob.mx,,0,0,http://sic.gob.mx/ficha.php?table=museo&table_id=1860,04/04/2017 13:55,,,
1670,Trapiche. Museo Interactivo,Ciencia y tecnologia,01/12/2014,"Patronato de Impulsora de la Cultura y de las Artes, I.A.P.",25,Sinaloa,1,Ahome,1,LOS MOCHIS,Blvd. Rosend G. Castro 711 Pte.,Centro,81200,,http://www.trapiche.org.mx/,,eayala@trapiche.org.mx,,-108.99904,25.78856,http://sic.gob.mx/ficha.php?table=museo&table_id=1670,22/04/2016 18:15,,,
316,Museo Regional del Valle del Fuerte,Arqueologia,03/03/1990,Instituto Sinaloense de Cultura,25,Sinaloa,1,Ahome,1,LOS MOCHIS,Antonio Rosales s/n,Centro,81200,,https://es-la.facebook.com/museoregionaldelVF,,museoregionalvf@culturasinaloa.gob.mx, museoreg@hotmail.com, romina.duarte@culturasinaloa.gob.mx,,-108.99976,25.79019,http://sic.gob.mx/ficha.php?table=museo&table_id=316,27/06/2016 11:31,
30,Museo Comunitario San Miguel Zapotitlan,Historia,29/09/2001,"Red Estatal de Museos Comunitarios y Ecomuseos de Sinaloa, A.C., Ayuntamiento de Ahome",25,Sinaloa,1,Ahome,227,SAN MIGUEL ZAPOTITLAN,Benito Juarez s/n,Col. Centro,81340,,,,,,-109.0518,25.94737,http://sic.gob.mx/ficha.php?table=museo&table_id=30,27/06/2016 11:59,,,
118,Museo Minero de Copala,Historia,15/05/2000,"Red Estatal de Museos Comunitarios y Ecomuseos de Sinaloa, A.C.<br>Ayuntamiento de Concordia",25,Sinaloa,4,Concordia,1,CONCORDIA,Domicilio conocido s/n,,82650,,,,dalia_rojas10@hotmail.com,,0,0,http://sic.gob.mx/ficha.php?table=museo&table_id=118,07/07/2015 12:58,,,
36,Museo Comunitario del General Domingo Rubi,Historia,05/05/1999,"Red Estatal de Museos Comunitarios y Ecomuseos de Sinaloa, A.C.",25,Sinaloa,4,Concordia,162,EL VERDE,Reforma s/n,Centro,82648,,,,,,-106.07006,23.29065,http://sic.gob.mx/ficha.php?table=museo&table_id=36,02/07/2015 12:36,,,
1864,Museo de Mineria e Historia,Ciencia y tecnologia,13/12/1980,Ayuntamiento de Cosala,25,Sinaloa,5,Cosala,1,COSALA,Calle Gabriel Leyva Solano s/n,Centro,70800,,http://www.cosala.gob.mx,,turismocosala@hotmail.com, emmanueldelgado06@gmail.com,,0,0,http://sic.gob.mx/ficha.php?table=museo&table_id=1864,23/02/2017 22:05,,
1603,Museo Interactivo sobre las Adicciones (MIA),Especializado,17/10/2012,Instituto MIA,25,Sinaloa,6,Culiacan,1,CULIACAN ROSALES,Av. Ruperto L. Paliza y Angel Flores 484 Nte.,Centro,80000,,http://mia.culiacan.gob.mx/museo/,,miateconecta@gmail.com, luisleontavera@gmail.com,,-107.39348,24.8093,http://sic.gob.mx/ficha.php?table=museo&table_id=1603,30/03/2017 12:03,,
586,Museo de Arte de Sinaloa (MASIN),Arte,21/11/1991,Instituto Sinaloense de Cultura,25,Sinaloa,6,Culiacan,1,CULIACAN ROSALES,Rafael Buelna esq.  Ruperto L. Paliza,Centro,80000,,http://www.culturasinaloa.gob.mx/index.php?option=com_content&view=category&id=191&Itemid=261,https://es-la.facebook.com/MuseoDeArteDeSinaloa,agleztorres@gmail.com,MASINculiacan,-107.39408,24.81078,http://sic.gob.mx/ficha.php?table=museo&table_id=586,04/04/2017 13:53,,,
